{
  "schema_version": "pvec-gold/expected.math/1",
  "fixture_id": "singular-001",
  "evidence_class": "KNOWN_TRUTH_EXACT",
  "units": {
    "name": "metre",
    "canonical": "metre",
    "scale_to_canonical": {
      "decimal": "1.0",
      "f64_hex": "0x3ff0000000000000"
    }
  },
  "provenance": {
    "derivation": "AUTHORING_PARAMETERS",
    "authoring_script": "tools/authoring/author_probes.py",
    "parameter_file": "tools/authoring/params/transforms/singular-001.json",
    "parameter_file_sha256": "8d221233cb1dac0daa6b69488db3b81dab47d530a927b89aa345fefd6133b5d1",
    "parameters": {
      "id": "singular-001",
      "group": "transforms",
      "kind": "transform",
      "description": "A line under scale (1, 0, 1), determinant exactly 0. The expected outcome is rejection, and a pipeline that emits geometry for it fails.",
      "base": {
        "class": "line",
        "start": [
          "0.5",
          "0.25",
          "0"
        ],
        "end": [
          "3.75",
          "2.5",
          "0"
        ]
      },
      "ops": [
        {
          "op": "scale",
          "s": [
            "1",
            "0",
            "1"
          ],
          "classification": "SINGULAR"
        }
      ],
      "expect": "reject",
      "rejection": {
        "classification": "SINGULAR_TRANSFORM",
        "disposition": "REJECT"
      }
    }
  },
  "entities": [
    {
      "id": "singular-001",
      "class": "line",
      "geometry": {
        "start": [
          {
            "decimal": "0.5",
            "f64_hex": "0x3fe0000000000000"
          },
          {
            "decimal": "0.25",
            "f64_hex": "0x3fd0000000000000"
          },
          {
            "decimal": "0.0",
            "f64_hex": "0x0000000000000000"
          }
        ],
        "end": [
          {
            "decimal": "3.75",
            "f64_hex": "0x400e000000000000"
          },
          {
            "decimal": "2.5",
            "f64_hex": "0x4004000000000000"
          },
          {
            "decimal": "0.0",
            "f64_hex": "0x0000000000000000"
          }
        ]
      },
      "parameter_domain": {
        "start": {
          "decimal": "0.0",
          "f64_hex": "0x0000000000000000"
        },
        "end": {
          "decimal": "1.0",
          "f64_hex": "0x3ff0000000000000"
        }
      },
      "closure": {
        "closed_by_endpoint": false,
        "closed_by_knots": false,
        "periodic": false
      },
      "structure": "INSTANCE_PLUS_TRANSFORM",
      "transform": {
        "convention": "ROW_MAJOR_COLUMN_VECTOR_PARENT_LEFT",
        "matrix": [
          {
            "decimal": "1.0",
            "f64_hex": "0x3ff0000000000000"
          },
          {
            "decimal": "0.0",
            "f64_hex": "0x0000000000000000"
          },
          {
            "decimal": "0.0",
            "f64_hex": "0x0000000000000000"
          },
          {
            "decimal": "0.0",
            "f64_hex": "0x0000000000000000"
          },
          {
            "decimal": "0.0",
            "f64_hex": "0x0000000000000000"
          },
          {
            "decimal": "0.0",
            "f64_hex": "0x0000000000000000"
          },
          {
            "decimal": "0.0",
            "f64_hex": "0x0000000000000000"
          },
          {
            "decimal": "0.0",
            "f64_hex": "0x0000000000000000"
          },
          {
            "decimal": "0.0",
            "f64_hex": "0x0000000000000000"
          },
          {
            "decimal": "0.0",
            "f64_hex": "0x0000000000000000"
          },
          {
            "decimal": "1.0",
            "f64_hex": "0x3ff0000000000000"
          },
          {
            "decimal": "0.0",
            "f64_hex": "0x0000000000000000"
          },
          {
            "decimal": "0.0",
            "f64_hex": "0x0000000000000000"
          },
          {
            "decimal": "0.0",
            "f64_hex": "0x0000000000000000"
          },
          {
            "decimal": "0.0",
            "f64_hex": "0x0000000000000000"
          },
          {
            "decimal": "1.0",
            "f64_hex": "0x3ff0000000000000"
          }
        ],
        "determinant": {
          "decimal": "0.0",
          "f64_hex": "0x0000000000000000"
        },
        "classification": "SINGULAR"
      },
      "rejection": {
        "classification": "SINGULAR_TRANSFORM",
        "disposition": "REJECT"
      }
    }
  ],
  "assertions": [
    {
      "id": "a1",
      "kind": "STRUCTURAL",
      "entity": "singular-001",
      "claim": "TRANSFORM_PRESERVED",
      "statement": "The source keeps an instance plus the stated transform; the matrix and determinant survive as written."
    },
    {
      "id": "a2",
      "kind": "STRUCTURAL",
      "entity": "singular-001",
      "claim": "REJECTED",
      "statement": "The pipeline must report SINGULAR_TRANSFORM (REJECT) and emit no curve for this entity."
    }
  ]
}
